[
  {
    "name": "Ridge",
    "display_name": "Ridge Regression",
    "task": ["regression"],
    "constructor_path": "sklearn.linear_model.Ridge",
    "default_params": {"alpha": 1.0, "fit_intercept": true},
    "optuna_space": {
      "alpha": {"type": "float", "low": 1e-4, "high": 100.0, "log": true}
    },
    "finetune_window": 0.5,
    "requires_scaling": true,
    "supports_warmstart": false,
    "tags": ["linear", "regularized", "fast"]
  },
  {
    "name": "Lasso",
    "display_name": "Lasso Regression",
    "task": ["regression"],
    "constructor_path": "sklearn.linear_model.Lasso",
    "default_params": {"alpha": 0.01, "fit_intercept": true, "max_iter": 5000},
    "optuna_space": {
      "alpha": {"type": "float", "low": 1e-4, "high": 10.0, "log": true}
    },
    "finetune_window": 0.5,
    "requires_scaling": true,
    "supports_warmstart": false,
    "tags": ["linear", "regularized", "sparse", "fast"]
  },
  {
    "name": "ElasticNet",
    "display_name": "Elastic Net",
    "task": ["regression"],
    "constructor_path": "sklearn.linear_model.ElasticNet",
    "default_params": {"alpha": 0.01, "l1_ratio": 0.5, "fit_intercept": true, "max_iter": 5000},
    "optuna_space": {
      "alpha":    {"type": "float", "low": 1e-4, "high": 10.0, "log": true},
      "l1_ratio": {"type": "float", "low": 0.0,  "high": 1.0}
    },
    "finetune_window": 0.4,
    "requires_scaling": true,
    "supports_warmstart": false,
    "tags": ["linear", "regularized", "sparse", "fast"]
  },
  {
    "name": "LogisticRegression",
    "display_name": "Logistic Regression",
    "task": ["classification"],
    "constructor_path": "sklearn.linear_model.LogisticRegression",
    "default_params": {
      "C": 1.0, "penalty": "l2", "solver": "lbfgs",
      "max_iter": 1000, "class_weight": "balanced"
    },
    "optuna_space": {
      "C":       {"type": "float", "low": 1e-3, "high": 100.0, "log": true},
      "penalty": {"type": "categorical", "choices": ["l2", "l1"]},
      "solver":  {"type": "categorical", "choices": ["lbfgs", "saga"]}
    },
    "finetune_window": 0.4,
    "requires_scaling": true,
    "supports_warmstart": false,
    "tags": ["linear", "interpretable", "fast", "classification"]
  },
  {
    "name": "RandomForestRegressor",
    "display_name": "Random Forest (Regression)",
    "task": ["regression"],
    "constructor_path": "sklearn.ensemble.RandomForestRegressor",
    "default_params": {
      "n_estimators": 200, "max_depth": null, "min_samples_leaf": 4,
      "max_features": "sqrt", "n_jobs": -1, "random_state": 42
    },
    "optuna_space": {
      "n_estimators":    {"type": "int",         "low": 50,  "high": 500},
      "max_depth":       {"type": "int",         "low": 3,   "high": 20},
      "min_samples_leaf":{"type": "int",         "low": 1,   "high": 30},
      "max_features":    {"type": "categorical", "choices": ["sqrt", "log2", 0.5, 0.7]}
    },
    "finetune_window": 0.2,
    "requires_scaling": false,
    "supports_warmstart": true,
    "tags": ["bagging", "ensemble", "tree"]
  },
  {
    "name": "RandomForestClassifier",
    "display_name": "Random Forest (Classification)",
    "task": ["classification", "ordinal"],
    "constructor_path": "sklearn.ensemble.RandomForestClassifier",
    "default_params": {
      "n_estimators": 200, "max_depth": null, "min_samples_leaf": 4,
      "max_features": "sqrt", "class_weight": "balanced",
      "n_jobs": -1, "random_state": 42
    },
    "optuna_space": {
      "n_estimators":    {"type": "int",         "low": 50,  "high": 500},
      "max_depth":       {"type": "int",         "low": 3,   "high": 20},
      "min_samples_leaf":{"type": "int",         "low": 1,   "high": 30},
      "max_features":    {"type": "categorical", "choices": ["sqrt", "log2", 0.5, 0.7]}
    },
    "finetune_window": 0.2,
    "requires_scaling": false,
    "supports_warmstart": true,
    "tags": ["bagging", "ensemble", "tree", "classification"]
  },
  {
    "name": "HistGradientBoostingRegressor",
    "display_name": "Histogram Gradient Boosting (Regression)",
    "task": ["regression"],
    "constructor_path": "sklearn.ensemble.HistGradientBoostingRegressor",
    "default_params": {
      "max_iter": 300, "max_depth": 6, "learning_rate": 0.05,
      "l2_regularization": 0.0, "min_samples_leaf": 20, "random_state": 42
    },
    "optuna_space": {
      "max_iter":          {"type": "int",   "low": 100, "high": 700},
      "max_depth":         {"type": "int",   "low": 3,   "high": 12},
      "learning_rate":     {"type": "float", "low": 0.005, "high": 0.3, "log": true},
      "l2_regularization": {"type": "float", "low": 1e-6,  "high": 10.0, "log": true},
      "min_samples_leaf":  {"type": "int",   "low": 5,   "high": 80}
    },
    "finetune_window": 0.2,
    "requires_scaling": false,
    "supports_warmstart": false,
    "tags": ["boosting", "tree", "fast", "handles-missing"]
  },
  {
    "name": "HistGradientBoostingClassifier",
    "display_name": "Histogram Gradient Boosting (Classification)",
    "task": ["classification", "ordinal"],
    "constructor_path": "sklearn.ensemble.HistGradientBoostingClassifier",
    "default_params": {
      "max_iter": 300, "max_depth": 6, "learning_rate": 0.05,
      "l2_regularization": 0.0, "min_samples_leaf": 20,
      "class_weight": "balanced", "random_state": 42
    },
    "optuna_space": {
      "max_iter":          {"type": "int",   "low": 100, "high": 700},
      "max_depth":         {"type": "int",   "low": 3,   "high": 12},
      "learning_rate":     {"type": "float", "low": 0.005, "high": 0.3, "log": true},
      "l2_regularization": {"type": "float", "low": 1e-6,  "high": 10.0, "log": true},
      "min_samples_leaf":  {"type": "int",   "low": 5,   "high": 80}
    },
    "finetune_window": 0.2,
    "requires_scaling": false,
    "supports_warmstart": false,
    "tags": ["boosting", "tree", "fast", "handles-missing", "classification"]
  },
  {
    "name": "XGBRegressor",
    "display_name": "XGBoost (Regression)",
    "task": ["regression"],
    "constructor_path": "xgboost.XGBRegressor",
    "default_params": {
      "n_estimators": 300, "max_depth": 6, "learning_rate": 0.05,
      "subsample": 0.8, "colsample_bytree": 0.8,
      "reg_alpha": 0.0, "reg_lambda": 1.0,
      "verbosity": 0, "random_state": 42, "n_jobs": -1
    },
    "optuna_space": {
      "n_estimators":    {"type": "int",   "low": 100, "high": 700},
      "max_depth":       {"type": "int",   "low": 3,   "high": 10},
      "learning_rate":   {"type": "float", "low": 0.005, "high": 0.3, "log": true},
      "subsample":       {"type": "float", "low": 0.5,  "high": 1.0},
      "colsample_bytree":{"type": "float", "low": 0.5,  "high": 1.0},
      "reg_alpha":       {"type": "float", "low": 1e-8,  "high": 10.0, "log": true},
      "reg_lambda":      {"type": "float", "low": 1e-8,  "high": 10.0, "log": true}
    },
    "finetune_window": 0.2,
    "requires_scaling": false,
    "supports_warmstart": false,
    "tags": ["boosting", "tree", "xgboost"]
  },
  {
    "name": "XGBClassifier",
    "display_name": "XGBoost (Classification)",
    "task": ["classification", "ordinal"],
    "constructor_path": "xgboost.XGBClassifier",
    "default_params": {
      "n_estimators": 300, "max_depth": 6, "learning_rate": 0.05,
      "subsample": 0.8, "colsample_bytree": 0.8,
      "reg_alpha": 0.0, "reg_lambda": 1.0,
      "scale_pos_weight": 1,
      "verbosity": 0, "random_state": 42, "n_jobs": -1,
      "eval_metric": "logloss"
    },
    "optuna_space": {
      "n_estimators":    {"type": "int",   "low": 100, "high": 700},
      "max_depth":       {"type": "int",   "low": 3,   "high": 10},
      "learning_rate":   {"type": "float", "low": 0.005, "high": 0.3, "log": true},
      "subsample":       {"type": "float", "low": 0.5,  "high": 1.0},
      "colsample_bytree":{"type": "float", "low": 0.5,  "high": 1.0},
      "reg_alpha":       {"type": "float", "low": 1e-8,  "high": 10.0, "log": true},
      "reg_lambda":      {"type": "float", "low": 1e-8,  "high": 10.0, "log": true}
    },
    "finetune_window": 0.2,
    "requires_scaling": false,
    "supports_warmstart": false,
    "tags": ["boosting", "tree", "xgboost", "classification"]
  },
  {
    "name": "CatBoostRegressor",
    "display_name": "CatBoost (Regression)",
    "task": ["regression"],
    "constructor_path": "catboost.CatBoostRegressor",
    "default_params": {
      "iterations": 500, "depth": 6, "learning_rate": 0.05,
      "l2_leaf_reg": 3.0, "min_data_in_leaf": 20, "verbose": 0,
      "random_seed": 42, "train_dir": ""
    },
    "optuna_space": {
      "iterations":       {"type": "int",   "low": 100, "high": 700},
      "depth":            {"type": "int",   "low": 3,   "high": 10},
      "learning_rate":    {"type": "float", "low": 0.005, "high": 0.3, "log": true},
      "l2_leaf_reg":      {"type": "float", "low": 0.001, "high": 10.0, "log": true},
      "min_data_in_leaf": {"type": "int",   "low": 5,   "high": 80}
    },
    "finetune_window": 0.2,
    "requires_scaling": false,
    "supports_warmstart": false,
    "tags": ["boosting", "tree", "catboost", "categorical-native"]
  },
  {
    "name": "CatBoostClassifier",
    "display_name": "CatBoost (Classification)",
    "task": ["classification"],
    "constructor_path": "catboost.CatBoostClassifier",
    "default_params": {
      "iterations": 500, "depth": 6, "learning_rate": 0.05,
      "l2_leaf_reg": 3.0, "min_data_in_leaf": 20,
      "auto_class_weights": "Balanced",
      "verbose": 0, "random_seed": 42, "train_dir": ""
    },
    "optuna_space": {
      "iterations":       {"type": "int",   "low": 100, "high": 700},
      "depth":            {"type": "int",   "low": 3,   "high": 10},
      "learning_rate":    {"type": "float", "low": 0.005, "high": 0.3, "log": true},
      "l2_leaf_reg":      {"type": "float", "low": 0.001, "high": 10.0, "log": true},
      "min_data_in_leaf": {"type": "int",   "low": 5,   "high": 80}
    },
    "finetune_window": 0.2,